{"schema_version":1,"trust_root_id":"phase5-fixture-root","artifact_kind":"verdict","artifact_digest":"sha256:1ff3722b27b785a859cfeb3a4ba12b7c5fd96afce3f0b8aa7c7ad2595af2674d","principal_id":"c-judge-instance-3","key_id":"judge-key-3","signature":"ed25519:e9f5dff91f439958a661bef47f3845913db37d0108497eb88b27f2a6a5380e926fe08773779379c376658a78e6ba8a5f14db0970808496606d197fedccf31504"}
