{"schema_version":1,"trust_root_id":"phase5-fixture-root","artifact_kind":"approval","artifact_digest":"sha256:e3262ffe08cd6a1a13f07e68b9cdb1eddc3e696005c032a2b2a77af17208bd41","principal_id":"human-security-reviewer","key_id":"human-key","signature":"ed25519:fed580e11bdde07703c1520e4236dbc412e902ef36fd774200ae65f5c7bf746a3daa789573ebb7c6ef7f62ba61ebac6a5032e732d9de7e5dacd4e451deb5e606"}
